{
  "schema_version": "1.1.0",
  "generated_at": "2026-05-07T00:00:00Z",
  "agent": {
    "name": "Vault Discovery Agent",
    "version": "1.0.0",
    "mode": "read-only-discovery"
  },
  "application": {
    "name": "Sample Application",
    "business_unit": "Unknown",
    "owner": "Unknown",
    "criticality": "Unknown"
  },
  "repository": {
    "path": "/path/to/sample-application",
    "repository_type": "Application repository",
    "monorepo": false,
    "partial_repository": false,
    "files_scanned": 128,
    "assumptions": [
      "Deployment model inferred from repository manifests and requires owner confirmation."
    ]
  },
  "technology_stack": {
    "languages": ["Java", "YAML"],
    "frameworks": ["Spring Boot", "Hibernate"],
    "runtime": ["JVM"],
    "build_tools": ["Maven"],
    "package_managers": ["Maven"]
  },
  "deployment_model": {
    "models": ["Kubernetes", "Docker"],
    "platforms": ["Unknown Kubernetes distribution"],
    "infrastructure_models": ["CI/CD pipeline"],
    "confidence": 0.82
  },
  "secret_inventory": [
    {
      "id": "secret-001",
      "type": "database credential",
      "location_type": "application config",
      "source": "src/main/resources/application.yml",
      "sensitivity": "High",
      "value_redacted": true,
      "rotation_candidate": true,
      "vault_mapping_candidate": "dynamic database secrets or kv-v2"
    }
  ],
  "current_secret_handling": [
    "Spring configuration references secret-like keys.",
    "Kubernetes manifests reference Secret objects.",
    "CI/CD appears to inject platform secrets."
  ],
  "risk_findings": [
    {
      "id": "config-file-secret-key",
      "title": "Secret-like keys in application configuration",
      "category": "secret-handling",
      "severity": "High",
      "confidence": 0.8,
      "description": "Application configuration contains secret-like keys. Values are redacted.",
      "migration_impact": "Move values to Vault-backed runtime injection or approved secret sync.",
      "recommended_action": "Map each key to Vault path and confirm runtime loading behavior.",
      "impact_entry_ids": ["impact-001"],
      "evidence_ids": ["ev-001"]
    }
  ],
  "code_change_impact_matrix": [
    {
      "id": "impact-001",
      "area": "config-only",
      "file_path": "src/main/resources/application.yml",
      "component_or_module": "Spring application configuration",
      "location_confidence": "Exact",
      "secret_usage_purpose": "Database credential configuration",
      "current_pattern": "Secret-like key in Spring YAML configuration",
      "current_retrieval_mechanism": "Spring property binding at application startup",
      "recommended_change": "Preserve the existing property key and source the value from a Vault Agent rendered file or injected template.",
      "replacement_approach": "Vault Agent Injector template with Kubernetes Auth",
      "modification_complexity": "Medium",
      "runtime_impact_risk": "Medium",
      "testing_impact": "Validate application startup, config binding, and rollback to previous secret source.",
      "backward_compatibility_concern": "Existing property names should be preserved to avoid application code changes.",
      "confidence": 0.85,
      "source_finding_ids": ["config-file-secret-key"],
      "evidence_ids": ["ev-001"],
      "assumptions": []
    },
    {
      "id": "impact-002",
      "area": "infrastructure",
      "file_path": "deploy/app.yaml",
      "component_or_module": "Kubernetes Deployment",
      "location_confidence": "Exact",
      "secret_usage_purpose": "Application runtime secret injection",
      "current_pattern": "Kubernetes Secret reference through environment variable",
      "current_retrieval_mechanism": "secretKeyRef",
      "recommended_change": "Replace or supplement Kubernetes Secret reference with Vault Agent Injector template or CSI mount.",
      "replacement_approach": "Kubernetes Auth with Vault Agent Injector",
      "modification_complexity": "Medium",
      "runtime_impact_risk": "Medium",
      "testing_impact": "Validate pod startup, service account auth, injected file permissions, and rollback manifest.",
      "backward_compatibility_concern": "Container environment variable names may need to remain stable during phased rollout.",
      "confidence": 0.82,
      "source_finding_ids": ["kubernetes-secret-reference"],
      "evidence_ids": ["ev-002"],
      "assumptions": []
    },
    {
      "id": "impact-003",
      "area": "database",
      "file_path": "probable: datasource configuration class or Spring datasource properties",
      "component_or_module": "Datasource initialization",
      "location_confidence": "Probable",
      "secret_usage_purpose": "Database connection credentials",
      "current_pattern": "Startup datasource pool initialization",
      "current_retrieval_mechanism": "Spring datasource properties",
      "recommended_change": "Test Vault dynamic database credentials and define pool eviction or restart behavior for rotation.",
      "replacement_approach": "Dynamic database secrets where operationally approved; KV v2 interim fallback",
      "modification_complexity": "High",
      "runtime_impact_risk": "High",
      "testing_impact": "Run credential rotation tests under active traffic and verify reconnect behavior.",
      "backward_compatibility_concern": "Existing pool lifecycle may not tolerate credential changes without restart.",
      "confidence": 0.68,
      "source_finding_ids": ["startup-only-config"],
      "evidence_ids": [],
      "assumptions": ["Datasource implementation file was not directly identified in the sample evidence."]
    },
    {
      "id": "impact-004",
      "area": "cicd",
      "file_path": ".github/workflows/*",
      "component_or_module": "Deployment workflow",
      "location_confidence": "Probable",
      "secret_usage_purpose": "Deployment-time secret flow",
      "current_pattern": "Platform secret references likely used during deployment",
      "current_retrieval_mechanism": "GitHub Actions secrets context",
      "recommended_change": "Use OIDC/JWT authentication to Vault and avoid long-lived Vault tokens in repository or organization secrets.",
      "replacement_approach": "OIDC/JWT auth for CI/CD",
      "modification_complexity": "Medium",
      "runtime_impact_risk": "Medium",
      "testing_impact": "Validate pipeline auth, least-privilege Vault policy, and masked logs.",
      "backward_compatibility_concern": "Existing secret names may be referenced by deployment scripts.",
      "confidence": 0.6,
      "source_finding_ids": ["cicd-secret-flow"],
      "evidence_ids": [],
      "assumptions": ["CI/CD workflow files are represented as a probable location in this sample."]
    }
  ],
  "impact_summary": {
    "likely_files_impacted": "3-6",
    "likely_services_or_modules_impacted": "1",
    "startup_runtime_impact_likelihood": "Medium",
    "refactoring_likelihood": "Medium",
    "backward_compatibility_concerns": [
      "Existing property and environment variable names should remain stable during migration.",
      "Datasource credential rotation may require restart or pool refresh.",
      "Rollback must preserve the prior Kubernetes Secret source until cutover is complete."
    ]
  },
  "migration_inventory": {
    "config_only_changes": [
      {
        "id": "impact-001",
        "area": "config-only",
        "file_path": "src/main/resources/application.yml",
        "component_or_module": "Spring application configuration",
        "location_confidence": "Exact",
        "secret_usage_purpose": "Database credential configuration",
        "current_pattern": "Secret-like key in Spring YAML configuration",
        "current_retrieval_mechanism": "Spring property binding at application startup",
        "recommended_change": "Preserve the existing property key and source the value from a Vault Agent rendered file or injected template.",
        "replacement_approach": "Vault Agent Injector template with Kubernetes Auth",
        "modification_complexity": "Medium",
        "runtime_impact_risk": "Medium",
        "testing_impact": "Validate application startup, config binding, and rollback to previous secret source.",
        "backward_compatibility_concern": "Existing property names should be preserved to avoid application code changes.",
        "confidence": 0.85,
        "source_finding_ids": ["config-file-secret-key"],
        "evidence_ids": ["ev-001"],
        "assumptions": []
      }
    ],
    "code_level_changes": [
      {
        "id": "impact-003",
        "area": "database",
        "file_path": "probable: datasource configuration class or Spring datasource properties",
        "component_or_module": "Datasource initialization",
        "location_confidence": "Probable",
        "secret_usage_purpose": "Database connection credentials",
        "current_pattern": "Startup datasource pool initialization",
        "current_retrieval_mechanism": "Spring datasource properties",
        "recommended_change": "Test Vault dynamic database credentials and define pool eviction or restart behavior for rotation.",
        "replacement_approach": "Dynamic database secrets where operationally approved; KV v2 interim fallback",
        "modification_complexity": "High",
        "runtime_impact_risk": "High",
        "testing_impact": "Run credential rotation tests under active traffic and verify reconnect behavior.",
        "backward_compatibility_concern": "Existing pool lifecycle may not tolerate credential changes without restart.",
        "confidence": 0.68,
        "source_finding_ids": ["startup-only-config"],
        "evidence_ids": [],
        "assumptions": ["Datasource implementation file was not directly identified in the sample evidence."]
      }
    ],
    "infrastructure_changes": [
      {
        "id": "impact-002",
        "area": "infrastructure",
        "file_path": "deploy/app.yaml",